," This is a citation overview for a set of 2000 documents.",,,,,,,,,,,,,,,,,,,,,,,,,
2020,"Cascabel: A Scalable and Versatile Amplicon Sequence Data Analysis Pipeline Delivering Reproducible and Documented Results","Abdala Asbun A., Besseling M.A., Balzano S., van Bleijswijk J.D.L., Witte H.J., Villanueva L., Engelmann J.C.",16648021,"Frontiers in Genetics",11, ,0,0,0,0,0,0,0,0,0,0,0,0,0,0,0,6,3,9,4,13
2020,"EventEpi-A natural language processing framework for event-based surveillance","Abbood A., Ullrich A., Busche R., Ghozzi S.",1553734X,"PLoS Computational Biology",16, 11,0,0,0,0,0,0,0,0,0,0,0,0,0,0,0,2,6,8,1,9
2020,"Self-Powered 6LoWPAN Sensor Node for Green IoT Edge Devices","Al-Kaseem B.R., Ahmed A.F., Abdullah A.M., Azouz T.Z., Al-Majidi S.D., Al-Raweshidy H.S.",17578981,"IOP Conference Series: Materials Science and Engineering",928, 2,0,0,0,0,0,0,0,0,0,0,0,0,0,0,0,0,1,1,2,3
2020,"Development of a display system for visualization in medical Applications","Almgoter H.B., Al-Dahan Z.T.",17426588,"Journal of Physics: Conference Series",1660, 1,0,0,0,0,0,0,0,0,0,0,0,0,0,0,0,1,3,4,0,4
2020,"Properties of breaking irregular waves over slopes","Aggarwal A., Alagan Chella M., Bihs H., Myrhaug D.",00298018,"Ocean Engineering",216, ,0,0,0,0,0,0,0,0,0,0,0,0,0,0,0,1,6,7,4,11
2020,"Workload-aware reviewer recommendation using a multi-objective search-based approach","Al-Zubaidi W.H.A., Thongtanunam P., Dam H.K., Tantithamthavorn C., Ghose A.",,"PROMISE 2020 - Proceedings of the 16th ACM International Conference on Predictive Models and Data Analytics in Software Engineering, Co-located with ESEC/FSE 2020",, ,0,0,0,0,0,0,0,0,0,0,0,0,0,0,0,3,7,10,8,18
2020,"Laser Attack Benchmark Suite","Amornpaisannon B., Diavastos A., Peh L.-S., Carlson T.E.",10923152,"IEEE/ACM International Conference on Computer-Aided Design, Digest of Technical Papers, ICCAD",2020-, ,0,0,0,0,0,0,0,0,0,0,0,0,0,0,0,0,0,0,1,1
2020,"Spatial Indexing for System-Level Evaluation of 5G Heterogeneous Cellular Networks","Amiri R., Balevi E., Andrews J.G., Mehrpouyan H.",15502252,"IEEE Vehicular Technology Conference",2020-, ,0,0,0,0,0,0,0,0,0,0,0,0,0,0,0,0,0,0,1,1
2020,"Fast spatial autocorrelation","Amgalan A., Mujica-Parodi L.R., Skiena S.S.",15504786,"Proceedings - IEEE International Conference on Data Mining, ICDM",2020-, ,0,0,0,0,0,0,0,0,0,0,0,0,0,0,0,0,0,0,0,0
2020,"Optimizing performance of GATK workflows using Apache Arrow In-Memory data framework","Ahmad T., Ahmed N., Al-Ars Z., Hofstee H.P.",14712164,"BMC Genomics",21, ,0,0,0,0,0,0,0,0,0,0,0,0,0,0,0,0,3,3,0,3
2020,"D-EE: Distributed software for visualizing intrinsic structure of large-scale single-cell data","An S., Huang J., Wan L.",2047217X,"GigaScience",9, 11,0,0,0,0,0,0,0,0,0,0,0,0,0,0,0,0,0,0,0,0
2020,"Looping with Do-It-Yourself Artificial Pancreas Systems During Ramadan Fasting in Type 1 Diabetes Mellitus: Perspectives of a User and a Physician","Ahmed S.H., Gallo S.",18696953,"Diabetes Therapy",11, 11,0,0,0,0,0,0,0,0,0,0,0,0,0,0,0,1,1,2,3,5
2020,"Comparison of deep learning approaches to predict COVID-19 infection","Alakus T.B., Turkoglu I.",09600779,"Chaos, Solitons and Fractals",140, ,0,0,0,0,0,0,0,0,0,0,0,0,0,0,4,52,72,128,79,207
2020,"FLAME: A library of atomistic modeling environments","Amsler M., Rostami S., Tahmasbi H., Khajehpasha E.R., Faraji S., Rasoulkhani R., Ghasemi S.A.",00104655,"Computer Physics Communications",256, ,0,0,0,0,0,0,0,0,0,0,0,0,0,0,3,12,2,17,3,20
2020,"Abstraction Layer for Standardizing APIs of Task-Based Engines","Alomairy R., Ltaief H., Abduljabbar M., Keyes D.",10459219,"IEEE Transactions on Parallel and Distributed Systems",31, 11,0,0,0,0,0,0,0,0,0,0,0,0,0,0,0,0,1,1,1,2
2020,"PERCH 2.0 : FFast and accurate GPU-based perception via search for object pose estimation","Agarwal A., Han Y., Likhachev M.",21530858,"IEEE International Conference on Intelligent Robots and Systems",, ,0,0,0,0,0,0,0,0,0,0,0,0,0,0,0,1,0,1,2,3
2020,"Discrete Element Modelling for biocemented sand: Effect of calcite distribution at the microscopic scale","Abbas M., Kunhappan D., Dadda A., Geindreau C., Emeriault F., Esnault-Filet A., Garandet A.",25550403,"E3S Web of Conferences",195, ,0,0,0,0,0,0,0,0,0,0,0,0,0,0,0,0,0,0,2,2
2020,"BigTest: A Symbolic Execution Based Systematic Test Generation Tool for Apache Spark","Ali Gulzar M., Musuvathi M., Kim M.",,"Proceedings - 2020 ACM/IEEE 42nd International Conference on Software Engineering: Companion, ICSE-Companion 2020",, ,0,0,0,0,0,0,0,0,0,0,0,0,0,0,0,1,0,1,2,3
2020,"Cardea: An open automated machine learning framework for electronic health records","Alnegheimish S., Alrashed N., Aleissa F., Althobaiti S., Liu D., Alsaleh M., Veeramachaneni K.",,"Proceedings - 2020 IEEE 7th International Conference on Data Science and Advanced Analytics, DSAA 2020",, ,0,0,0,0,0,0,0,0,0,0,0,0,0,0,0,0,4,4,2,6
2020,"J-Modl: Joint model-based deep learning for optimized sampling and reconstruction","Aggarwal H.K., Jacob M.",19324553,"IEEE Journal on Selected Topics in Signal Processing",14, 6,0,0,0,0,0,0,0,0,0,0,0,0,0,0,3,8,16,27,13,40
2020,"Calculation of immune cell proportion from batch tumor gene expression profile based on support vector regression","Ai D., Liu G., Li X., Wang Y., Guo M.",02197200,"Journal of Bioinformatics and Computational Biology",18, 5,0,0,0,0,0,0,0,0,0,0,0,0,0,0,0,0,1,1,0,1
2020,"A recurrent deep network for estimating the pose of real indoor images from synthetic image sequences","Acharya D., Roy S.S., Khoshelham K., Winter S.",14248220,"Sensors (Switzerland)",20, 19,0,0,0,0,0,0,0,0,0,0,0,0,0,0,0,2,11,13,5,18
2020,"Reconstruction of clone- And haplotype-specific cancer genome karyotypes from bulk tumor samples","Aganezov S., Raphael B.J.",10889051,"Genome Research",30, 9,0,0,0,0,0,0,0,0,0,0,0,0,0,0,1,2,3,6,2,8
2020,"FIBR-OSS: Fault injection model for bug reports in open-source software","Alazawi S.A., Al-Salam M.N.",25024752,"Indonesian Journal of Electrical Engineering and Computer Science",20, 1,0,0,0,0,0,0,0,0,0,0,0,0,0,0,0,1,0,1,0,1
2020,"Idda: A large-scale multi-domain dataset for autonomous driving","Alberti E., Tavera A., Masone C., Caputo B.",23773766,"IEEE Robotics and Automation Letters",5, 4,0,0,0,0,0,0,0,0,0,0,0,0,0,0,1,4,9,14,9,23
2020,"Low-cost open hardware system for behavioural experiments simultaneously with electrophysiological recordings","Aguiar L.A.A., de Vasconcelos N.A.P., Tunes G.C., Fontenele A.J., de Albuquerque Nogueira R., Reyes M.B., Carelli P.V.",24680672,"HardwareX",8, ,0,0,0,0,0,0,0,0,0,0,0,0,0,0,0,0,0,0,0,0
2020,"A two-stage machine learning framework to predict heart transplantation survival probabilities over time with a monotonic probability constraint","Ahady Dolatsara H., Chen Y.-J., Evans C., Gupta A., Megahed F.M.",01679236,"Decision Support Systems",137, ,0,0,0,0,0,0,0,0,0,0,0,0,0,0,0,2,6,8,5,13
2020,"Ford Multi-AV Seasonal Dataset","Agarwal S., Vora A., Pandey G., Williams W., Kourous H., McBride J.",02783649,"International Journal of Robotics Research",39, 12,0,0,0,0,0,0,0,0,0,0,0,0,0,0,0,6,19,25,21,46
2020,"Application for Iraqi sign language translation on android system","Alobaidy M.A., Ebraheem S.K.",20888708,"International Journal of Electrical and Computer Engineering",10, 5,0,0,0,0,0,0,0,0,0,0,0,0,0,0,0,1,3,4,1,5
2020,"Benchmarking open source deep learning frameworks","Al-Bdour G., Al-Qurran R., Al-Ayyoub M., Shatnawi A.",20888708,"International Journal of Electrical and Computer Engineering",10, 5,0,0,0,0,0,0,0,0,0,0,0,0,0,0,1,3,1,5,1,6
2020,"Benchmarking neural embeddings for link prediction in knowledge graphs under semantic and structural changes","Agibetov A., Samwald M.",15708268,"Journal of Web Semantics",64, ,0,0,0,0,0,0,0,0,0,0,0,0,0,0,0,0,4,4,0,4
2020,"An empirical analysis of source code metrics and smart contract resource consumption","Ajienka N., Vangorp P., Capiluppi A.",20477481,"Journal of Software: Evolution and Process",32, 10,0,0,0,0,0,0,0,0,0,0,0,0,0,0,0,2,4,6,6,12
2020,"ECSNeT++: A simulator for distributed stream processing on edge and cloud environments","Amarasinghe G., de Assuncao M.D., Harwood A., Karunasekera S.",0167739X,"Future Generation Computer Systems",111, ,0,0,0,0,0,0,0,0,0,0,0,0,0,0,1,4,5,10,1,11
2020,"Comparing Eight Parameter Estimation Methods for the Ratcliff Diffusion Model Using Free Software","Alexandrowicz R.W., Gula B.",16641078,"Frontiers in Psychology",11, ,0,0,0,0,0,0,0,0,0,0,0,0,0,0,0,0,3,3,2,5
2020,"Identity document to selfie face matching across adolescence","Albiero V., Srinivas N., Villalobos E., Perez-Facuse J., Rosenthal R., Mery D., Ricanek K., Bowyer K.W.",,"IJCB 2020 - IEEE/IAPR International Joint Conference on Biometrics",, ,0,0,0,0,0,0,0,0,0,0,0,0,0,0,0,0,0,0,1,1
2020,"Model-based clustering for flow and mass cytometry data with clinical information","Abe K., Minoura K., Maeda Y., Nishikawa H., Shimamura T.",14712105,"BMC Bioinformatics",21, ,0,0,0,0,0,0,0,0,0,0,0,0,0,0,0,1,2,3,2,5
2020,"GPU acceleration of Darwin read overlapper for de novo assembly of long DNA reads","Ahmed N., Qiu T.D., Bertels K., Al-Ars Z.",14712105,"BMC Bioinformatics",21, ,0,0,0,0,0,0,0,0,0,0,0,0,0,0,0,1,1,2,2,4
2020,"Global uncertainty-sensitivity analysis on mechanistic kinetic models: From model assessment to theory-driven design of nanoparticles","Andalibi M.R., Bowen P., Carino A., Testino A.",00981354,"Computers and Chemical Engineering",140, ,0,0,0,0,0,0,0,0,0,0,0,0,0,0,0,0,2,2,0,2
2020,"An R Package for Generating Covariance Matrices for Maximum-Entropy Sampling from Precipitation Chemistry Data","Al-Thani H., Lee J.",26622556,"Operations Research Forum",1, 3,0,0,0,0,0,0,0,0,0,0,0,0,0,0,0,1,0,1,1,2
2020,"CGPOPS: A C++ Software for Solving Multiple-Phase Optimal Control Problems Using Adaptive Gaussian Quadrature Collocation and Sparse Nonlinear Programming","Agamawi Y.M., Rao A.V.",00983500,"ACM Transactions on Mathematical Software",46, 3,0,0,0,0,0,0,0,0,0,0,0,0,0,0,2,4,5,11,6,17
2020,"Low-Cost, open-source mechanical ventilator with pulmonary monitoring for COVID-19 patients","Acho L., Vargas A.N., Pujol-Vazquez G.",20760825,"Actuators",9, 3,0,0,0,0,0,0,0,0,0,0,0,0,0,0,0,12,7,19,2,21
2020,"Wildfire risk assessment based on geospatial open data: Application on chios, greece","Adaktylou N., Stratoulias D., Landenberger R.",22209964,"ISPRS International Journal of Geo-Information",9, 9,0,0,0,0,0,0,0,0,0,0,0,0,0,0,0,3,1,4,6,10
2020,"FETCH: A deep-learning based classifier for fast transient classification","Agarwal D., Aggarwal K., Burke-Spolaor S., Lorimer D.R., Garver-Daniels N.",00358711,"Monthly Notices of the Royal Astronomical Society",497, 2,0,0,0,0,0,0,0,0,0,0,0,0,0,0,3,15,24,42,17,59
2020,"An external client-based approach for the extract class refactoring: A theoretical model and an empirical approach","Alzahrani M., Alqithami S.",20763417,"Applied Sciences (Switzerland)",10, 17,0,0,0,0,0,0,0,0,0,0,0,0,0,0,0,0,1,1,0,1
2020,"Do-It-Yourself (DIY) Artificial Pancreas Systems for Type 1 Diabetes: Perspectives of Two Adult Users, Parent of a User and Healthcare Professionals","Ahmed S.H., Ewins D.L., Bridges J., Timmis A., Payne N., Mooney C., MacGregor C.",0741238X,"Advances in Therapy",37, 9,0,0,0,0,0,0,0,0,0,0,0,0,0,0,1,4,6,11,3,14
2020,"An empirical comparison of commercial and open-source web vulnerability scanners","Amankwah R., Chen J., Kudjo P.K., Towey D.",00380644,"Software - Practice and Experience",50, 9,0,0,0,0,0,0,0,0,0,0,0,0,0,0,0,7,8,15,8,23
2020,"Recommendations for the analysis of gene expression data to identify intrinsic differences between similar tissues","Abbassi-Daloii T., Kan H.E., Raz V., 't Hoen P.A.C.",08887543,"Genomics",112, 5,0,0,0,0,0,0,0,0,0,0,0,0,0,0,0,2,3,5,2,7
2020,"Electron transport in gaseous detectors with a Python-based Monte Carlo simulation code","Al Atoum B., Biagi S.F., Gonzalez-Diaz D., Jones B.J.P., McDonald A.D.",00104655,"Computer Physics Communications",254, ,0,0,0,0,0,0,0,0,0,0,0,0,0,0,1,2,7,10,1,11
2020,"Mirheo: High-performance mesoscale simulations for microfluidics","Alexeev D., Amoudruz L., Litvinov S., Koumoutsakos P.",00104655,"Computer Physics Communications",254, ,0,0,0,0,0,0,0,0,0,0,0,0,0,0,0,1,3,4,2,6
2020,"An Interactive and Dynamic Search-Based Approach to Software Refactoring Recommendations","Alizadeh V., Kessentini M., Mkaouer M.W., Ocinneide M., Ouni A., Cai Y.",00985589,"IEEE Transactions on Software Engineering",46, 9,0,0,0,0,0,0,0,0,0,0,0,0,0,0,1,4,7,12,12,24
2020,"Distributed Implementation of Boolean Functions by Transcriptional Synthetic Circuits","Al-Radhawi M.A., Tran A.P., Ernst E.A., Chen T., Voigt C.A., Sontag E.D.",21615063,"ACS Synthetic Biology",9, 8,0,0,0,0,0,0,0,0,0,0,0,0,0,0,0,5,2,7,4,11
2020,"ENANO: Encoder for NANOpore FASTQ files","Alvarez G.D., Seroussi G., Smircich P., Sotelo J., Ochoa I., Martin A.",13674803,"Bioinformatics",36, 16,0,0,0,0,0,0,0,0,0,0,0,0,0,0,1,1,3,5,2,7
2020,"Open source, low-cost device for thermometric titration with non-contact temperature measurement","Alessio K.O., Tischer B., Voss M., Teixeira I.D., Brendler B.M., Duarte F.A., Helfer G.A., Costa A.B., Barin J.S.",00399140,"Talanta",216, ,0,0,0,0,0,0,0,0,0,0,0,0,0,0,0,3,1,4,2,6
2020,"Algorithmic trading in a microstructural limit order book model","Abergel F., Hure C., Pham H.",14697688,"Quantitative Finance",20, 8,0,0,0,0,0,0,0,0,0,0,0,0,0,0,1,4,0,5,4,9
2020,"A collaborative access control framework for online social networks","Alshareef H., Pardo R., Schneider G., Picazo-Sanchez P.",23522208,"Journal of Logical and Algebraic Methods in Programming",114, ,0,0,0,0,0,0,0,0,0,0,0,0,0,0,0,1,1,2,2,4
2020,"A Recursive Algebraic Coloring Technique for Hardware-efficient Symmetric Sparse Matrix-vector Multiplication","Alappat C., Basermann A., Bishop A.R., Fehske H., Hager G., Schenk O., Thies J., Wellein G.",23294949,"ACM Transactions on Parallel Computing",7, 3,0,0,0,0,0,0,0,0,0,0,0,0,0,0,1,14,19,34,22,56
2020,"BioPAX-Parser: Parsing and enrichment analysis of BioPAX pathways","Agapito G., Pastrello C., Guzzi P.H., Jurisica I., Cannataro M.",13674803,"Bioinformatics",36, 15,0,0,0,0,0,0,0,0,0,0,0,0,0,0,1,5,8,14,0,14
2020,"Tobacco cessation behavior among smoking and smokeless form tobacco users in the indigenous population of Ernakulam, India","Aluckal E., Pulayath C., Chithra P., Balakrishna M.S., Luke A.M., Mathew S.",09757406,"Journal of Pharmacy and Bioallied Sciences",12, 5,0,0,0,0,0,0,0,0,0,0,0,0,0,0,0,1,1,2,1,3
2020,"Test suites effectiveness evolution in open source systems: Empirical study","Akour M., Alenezi M.",25024752,"Indonesian Journal of Electrical Engineering and Computer Science",19, 2,0,0,0,0,0,0,0,0,0,0,0,0,0,0,1,2,0,3,0,3
2020,"Hybridization of complete PLCA and MRIO databases for a comprehensive product system coverage","Agez M., Wood R., Margni M., Stromman A.H., Samson R., Majeau-Bettez G.",10881980,"Journal of Industrial Ecology",24, 4,0,0,0,0,0,0,0,0,0,0,0,0,0,0,2,5,8,15,4,19
2020,"Performance Evaluation of Mini Single Board Computer in Hadoop Big Data Cluster","Adnan, Tahir Z., Yohannes C., Ariel",17578981,"IOP Conference Series: Materials Science and Engineering",875, 1,0,0,0,0,0,0,0,0,0,0,0,0,0,0,0,0,1,1,1,2
2020,"Iraqi colloquial dialect dictionary corpus creation, analyzing and translation","Abutiheen Z.A., Albeer R.A., Mousa A.F., Hamza N.M., Nasrawi D.A.",17578981,"IOP Conference Series: Materials Science and Engineering",870, 1,0,0,0,0,0,0,0,0,0,0,0,0,0,0,0,0,1,1,0,1
2020,"Florida research open-source synchronization tool (FROST) for electrophysiology experiments","Alcantara J.D., Eisinger R.S., Opri E., Kelberman M., Cagle J.N., Gomez J., Foote K.D., Okun M.S., Gunduz A.",01650270,"Journal of Neuroscience Methods",341, ,0,0,0,0,0,0,0,0,0,0,0,0,0,0,1,2,2,5,0,5
2020,"SPOCC: Scalable POssibilistic Classifier Combination - toward robust aggregation of classifiers","Albardan M., Klein J., Colot O.",09574174,"Expert Systems with Applications",150, ,0,0,0,0,0,0,0,0,0,0,0,0,0,0,1,2,2,5,1,6
2020,"A multidisciplinary approach to archaeological research in Sant'Arsenio (Salerno, Italy): New methodologies and consolidated practices for the knowledge of cultural heritage","Abate N., Aromando A., Lasaponara R.",17551307,"IOP Conference Series: Earth and Environmental Science",509, 1,0,0,0,0,0,0,0,0,0,0,0,0,0,0,0,0,0,0,0,0
2020,"Zigator: Analyzing the security of zigbee-enabled smart homes","Akestoridis D.-G., Harishankar M., Weber M., Tague P.",,"WiSec 2020 - Proceedings of the 13th ACM Conference on Security and Privacy in Wireless and Mobile Networks",, ,0,0,0,0,0,0,0,0,0,0,0,0,0,0,2,5,8,15,6,21
2020,"Bioinformatics recipes: Creating, executing and distributing reproducible data analysis workflows","Aberra N., Sebastian A., Maloy A.P., Rees C.B., Bartron M.L., Albert I.",14712105,"BMC Bioinformatics",21, 1,0,0,0,0,0,0,0,0,0,0,0,0,0,0,0,1,0,1,0,1
2020,"Multi-Dialect Arabic Speech Recognition","Ali A.R.",,"Proceedings of the International Joint Conference on Neural Networks",, ,0,0,0,0,0,0,0,0,0,0,0,0,0,0,0,0,5,5,3,8
2020,"Graphical interface for automated management of motion artifact within fMRI acquisitions: INFOBAR","Anand M., Diekfuss J.A., Slutsky-Ganesh A.B., Bonnette S., Grooms D.R., Myer G.D.",23527110,"SoftwareX",12, ,0,0,0,0,0,0,0,0,0,0,0,0,0,0,0,1,2,3,2,5
2020,"OPAL-MITHRA: Self-consistent Software for Start-to-End Simulation of Undulator-based Facilities","Alba A., Adelmann A., Fallahi A.",,"33rd International Vacuum Nanoelectronics Conference, IVNC 2020",, ,0,0,0,0,0,0,0,0,0,0,0,0,0,0,0,2,1,3,0,3
2020,"An open-source automated algorithm for removal of noisy beats for accurate impedance cardiogram analysis","Ali Sheikh S.-A., Shah A., Levantsevych O., Soudan M., Alkhalaf J., Bahrami Rad A., Inan O.T., Clifford G.D.",09673334,"Physiological Measurement",41, 7,0,0,0,0,0,0,0,0,0,0,0,0,0,0,0,3,4,7,3,10
2020,"YAWL: An open source Business Process Management System from science for science","Adams M., Hense A.V., ter Hofstede A.H.M.",23527110,"SoftwareX",12, ,0,0,0,0,0,0,0,0,0,0,0,0,0,0,0,0,7,7,2,9
2020,"Numerical study of shear banding in flows of fluids governed by the rolie-poly two-fluid model via stabilized finite volume methods","Abuga J.G., Chinyoka T.",22279717,"Processes",8, 7,0,0,0,0,0,0,0,0,0,0,0,0,0,0,0,1,3,4,2,6
2020,"Two-stage monitoring of patients in intensive care unit for sepsis prediction using non-overfitted machine learning models","Abromavicius V., Plonis D., Tarasevicius D., Serackis A.",20799292,"Electronics (Switzerland)",9, 7,0,0,0,0,0,0,0,0,0,0,0,0,0,0,0,5,6,11,5,16
2020,"Timber: An SDN-Based Emulation Platform for Experimental Research on Video Streaming","Ahmad A., Floris A., Atzori L.",07338716,"IEEE Journal on Selected Areas in Communications",38, 7,0,0,0,0,0,0,0,0,0,0,0,0,0,0,0,2,4,6,6,12
2020,"Chipyard: Integrated Design, Simulation, and Implementation Framework for Custom SoCs","Amid A., Biancolin D., Gonzalez A., Grubb D., Karandikar S., Liew H., Magyar A., Mao H., Ou A., Pemberton N., Rigge P., Schmidt C., Wright J., Zhao J., Shao Y.S., Asanovic K., Nikolic B.",02721732,"IEEE Micro",40, 4,0,0,0,0,0,0,0,0,0,0,0,0,0,0,3,19,36,58,42,100
2020,"Proximal-distal shift of the center of rotation in a total wrist arthroplasty is more than twice of the healthy wrist","Akhbari B., Morton A.M., Shah K.N., Molino J., Moore D.C., Weiss A.-P.C., Wolfe S.W., Crisco J.J.",07360266,"Journal of Orthopaedic Research",38, 7,0,0,0,0,0,0,0,0,0,0,0,0,0,0,2,4,6,12,0,12
2020,"MitoFinder: Efficient automated large-scale extraction of mitogenomic data in target enrichment phylogenomics","Allio R., Schomaker-Bastos A., Romiguier J., Prosdocimi F., Nabholz B., Delsuc F.",1755098X,"Molecular Ecology Resources",20, 4,0,0,0,0,0,0,0,0,0,0,0,0,0,0,2,25,100,127,112,239
2020,"Modeling transport of charged species in pore networks: Solution of the Nernst–Planck equations coupled with fluid flow and charge conservation equations","Agnaou M., Sadeghi M.A., Tranter T.G., Gostick J.T.",00983004,"Computers and Geosciences",140, ,0,0,0,0,0,0,0,0,0,0,0,0,0,0,0,5,7,12,5,17
2020,"Efficient and Scalable Universal Circuits","Alhassan M.Y., Gunther D., Kiss A., Schneider T.",09332790,"Journal of Cryptology",33, 3,0,0,0,0,0,0,0,0,0,0,0,0,0,0,2,3,1,6,3,9
2020,"Breakpad: Diversified binary crash reporting","Abrath B., Coppens B., Mishra M., Van Den Broeck J., De Sutter B.",15455971,"IEEE Transactions on Dependable and Secure Computing",17, 4,0,0,0,0,0,0,0,0,0,0,0,0,0,0,0,1,0,1,0,1
2020,"Computer Vision-based Reader for analogue Energy/Water Meters in low-cost embedded System: A Case Study in an Office Building in Scotland","Adalberto G.-C., Giulia B., Giovanni T., Girish M.U.",25550403,"E3S Web of Conferences",172, ,0,0,0,0,0,0,0,0,0,0,0,0,0,0,0,0,0,0,0,0
2020,"Cheating Death: A Statistical Survival Analysis of Publicly Available Python Projects","Ali R.H., Parlett-Pelleriti C., Linstead E.",,"Proceedings - 2020 IEEE/ACM 17th International Conference on Mining Software Repositories, MSR 2020",, ,0,0,0,0,0,0,0,0,0,0,0,0,0,0,0,0,1,1,1,2
2020,"Deconvolution of bulk blood eQTL effects into immune cell subpopulations","Aguirre-Gamboa R., De Klein N., Di Tommaso J., Claringbould A., Van Der Wijst M.G.P., De Vries D., Brugge H., Oelen R., Vosa U., Vosa U., Zorro M.M., Chu X., Chu X., Bakker O.B., Borek Z., Ricano-Ponce I., Deelen P., Deelen P., Xu C.-J., Xu C.-J., Swertz M., Jonkers I., Withoff S., Joosten I., Sanna S., Kumar V., Kumar V., Koenen H.J.P.M., Joosten L.A.B., Netea M.G., Wijmenga C., Franke L., Li Y.",14712105,"BMC Bioinformatics",21, 1,0,0,0,0,0,0,0,0,0,0,0,0,0,0,0,10,8,18,6,24
2020,"VSeq-Toolkit: Comprehensive Computational Analysis of Viral Vectors in Gene Therapy","Afzal S., Fronza R., Schmidt M.",23290501,"Molecular Therapy - Methods and Clinical Development",17, ,0,0,0,0,0,0,0,0,0,0,0,0,0,0,0,1,1,2,4,6
2020,"Typilus: Neural type hints","Allamanis M., Barr E.T., Ducousso S., Gao Z.",,"Proceedings of the ACM SIGPLAN Conference on Programming Language Design and Implementation (PLDI)",, ,0,0,0,0,0,0,0,0,0,0,0,0,0,0,3,16,22,41,20,61
2020,"A feature selection model for network intrusion detection system based on pso, gwo, ffa and ga algorithms","Almomani O.",20738994,"Symmetry",12, 6,0,0,0,0,0,0,0,0,0,0,0,0,0,0,3,25,50,78,43,121
2020,"A community-maintained standard library of population genetic models","Adrion J.R., Cole C.B., Dukler N., Galloway J.G., Gladstein A.L., Gower G., Kyriazis C.C., Ragsdale A.P., Tsambos G., Baumdicker F., Carlson J., Cartwright R.A., Durvasula A., Gronau I., Kim B.Y., McKenzie P., Messer P.W., Noskova E., Vecchyo D.O.-D., Racimo F., Struck T.J., Gravel S., Gutenkunst R.N., Lohmueller K.E., Ralph P.L., Schrider D.R., Siepel A., Kelleher J., Kern A.D.",2050084X,"eLife",9, ,0,0,0,0,0,0,0,0,0,0,0,0,0,0,6,18,15,39,17,56
2020,"A fully implicit finite volume scheme for a seawater intrusion problem in coastal aquifers","Aharmouch A., Amaziane B., Ossmani M.E., Talali K.",20734441,"Water (Switzerland)",12, 6,0,0,0,0,0,0,0,0,0,0,0,0,0,0,0,1,0,1,2,3
2020,"A distributed stream processing middleware framework for real-time analysis of heterogeneous data on big data platform: Case of environmental monitoring","Akanbi A., Masinde M.",14248220,"Sensors (Switzerland)",20, 11,0,0,0,0,0,0,0,0,0,0,0,0,0,0,3,3,3,9,6,15
2020,"CRAMER: A lightweight, highly customizable web-based genome browser supporting multiple visualization instances","Anastasiadi M., Bragin E., Biojoux P., Ahamed A., Burgin J., De Castro Cogle K., Llaneza-Lago S., Muvunyi R., Scislak M., Aktan I., Molitor C., Kurowski T., Mohareb F.",13674803,"Bioinformatics",36, 11,0,0,0,0,0,0,0,0,0,0,0,0,0,0,0,0,0,0,0,0
2020,"Evaluation of hydrokinetic energy potentials of selected rivers in Kwara state, Nigeria","Adeogun A.G., Ganiyu H.O., Ladokun L.L., Ibitoye B.A.",12261025,"Environmental Engineering Research",25, 3,0,0,0,0,0,0,0,0,0,0,0,0,0,0,1,0,2,3,4,7
2020,"Characterization of the response to abiotic stresses of high ascorbate Arabidopsis lines using phenomic approaches","Acosta-Gamboa L.M., Suxing L., Jarrod W C., Zachary C C., Raquel T., Walter P S., Jessica P Y.-C., Argelia L.",09819428,"Plant Physiology and Biochemistry",151, ,0,0,0,0,0,0,0,0,0,0,0,0,0,0,0,1,1,2,3,5
2020,"Altmetrics of the Open Access Institutional Repositories: a webometrics approach","Aguillo I.F.",01389130,"Scientometrics",123, 3,0,0,0,0,0,0,0,0,0,0,0,0,0,0,0,1,6,7,3,10
2020,"Modeling brain dynamics after tumor resection using The Virtual Brain","Aerts H., Schirner M., Dhollander T., Jeurissen B., Achten E., Van Roost D., Ritter P., Marinazzo D.",10538119,"NeuroImage",213, ,0,0,0,0,0,0,0,0,0,0,0,0,0,0,4,5,11,20,8,28
2020,"HyperQuant - A Computational Pipeline for Higher Order Multiplexed Quantitative Proteomics","Aggarwal S., Kumar A., Jamwal S., Midha M.K., Talukdar N.C., Yadav A.K.",24701343,"ACS Omega",5, 19,0,0,0,0,0,0,0,0,0,0,0,0,0,0,0,2,1,3,2,5
2020,"Research report: Building a wide reach corpus for secure parser development","Allison T., Burke W., Constantinou V., Goh E., Mattmann C., Mensikova A., Southam P., Stonebraker R., Timmaraju V.",,"Proceedings - 2020 IEEE Symposium on Security and Privacy Workshops, SPW 2020",, ,0,0,0,0,0,0,0,0,0,0,0,0,0,0,0,1,2,3,2,5
2020,"Atlas: Exploration and Mapping with a Sparse Swarm of Networked IoT Robots","Abu-Aisheh R., Bronzino F., Rifai M., Kilberg B., Pister K., Watteyne T.",,"Proceedings - 16th Annual International Conference on Distributed Computing in Sensor Systems, DCOSS 2020",, ,0,0,0,0,0,0,0,0,0,0,0,0,0,0,0,4,2,6,1,7
2020,"Tensorflowaudio models in essentia","Alonso-Jimenez P., Bogdanov D., Pons J., Serra X.",15206149,"ICASSP, IEEE International Conference on Acoustics, Speech and Signal Processing - Proceedings",2020-, ,0,0,0,0,0,0,0,0,0,0,0,0,0,0,0,5,5,10,2,12
2020,"Towards social capital in a network organization: A conceptual model and an empirical approach","Alqithami S., Budiarto R., Alzahrani M., Hexmoor H.",10994300,"Entropy",22, 5,0,0,0,0,0,0,0,0,0,0,0,0,0,0,0,0,0,0,0,0
