," This is a citation overview for a set of 2000 documents.",,,,,,,,,,,,,,,,,,,,,,,,,
2022,"What can CMB observations tell us about the neutrino distribution function?","Alvey J., Escudero M., Sabti N.",14757516,"Journal of Cosmology and Astroparticle Physics",2022, 2,0,0,0,0,0,0,0,0,0,0,0,0,0,0,0,0,3,3,4,7
2022,"Non-Polar Gallium Nitride for Photodetection Applications: A Systematic Review","Al-Zuhairi O., Shuhaimi A., Nayan N., Azman A., Kamarudzaman A., Alobaidi O., Ghanim M., Abdullah E.T., Zhu Y.",20796412,"Coatings",12, 2,0,0,0,0,0,0,0,0,0,0,0,0,0,0,0,0,1,1,7,8
2022,"Assignment of a Synthetic Population for Activity-Based Modeling Employing Publicly Available Data","Agriesti S., Roncoli C., Nahmias-Biran B.-H.",22209964,"ISPRS International Journal of Geo-Information",11, 2,0,0,0,0,0,0,0,0,0,0,0,0,0,0,0,0,1,1,5,6
2022,"Re-Learning EXP3 Multi-Armed Bandit Algorithm for Enhancing the Massive IoT-LoRaWAN Network Performance","Almarzoqi S.A., Yahya A., Matar Z., Gomaa I.",14248220,"Sensors",22, 4,0,0,0,0,0,0,0,0,0,0,0,0,0,0,0,0,1,1,3,4
2022,"A Tale of Shaheen’s Cyclone Consequences in Al Khaboura City, Oman","Alruheili A.M.",20734441,"Water (Switzerland)",14, 3,0,0,0,0,0,0,0,0,0,0,0,0,0,0,0,0,1,1,3,4
2022,"Can I Trust This Location Estimate? Reproducibly Benchmarking the Methods of Dynamic Accuracy Estimation of Localization","Anagnostopoulos G.G., Kalousis A.",14248220,"Sensors",22, 3,0,0,0,0,0,0,0,0,0,0,0,0,0,0,0,0,1,1,3,4
2022,"Development smart eyeglasses for visually impaired people based on you only look once","Abdul-Ameer H.S., Hassan H.J., Abdullah S.H.",16936930,"Telkomnika (Telecommunication Computing Electronics and Control)",20, 1,0,0,0,0,0,0,0,0,0,0,0,0,0,0,0,0,2,2,2,4
2022,"A tool for solving bone growth related problems using finite elements adaptive meshes","Alonso M.G., Yawny A., Bertolino G.",17516161,"Journal of the Mechanical Behavior of Biomedical Materials",126, ,0,0,0,0,0,0,0,0,0,0,0,0,0,0,0,0,1,1,0,1
2022,"Overall Survival Prognostic Modelling of Non-small Cell Lung Cancer Patients Using Positron Emission Tomography/Computed Tomography Harmonised Radiomics Features: The Quest for the Optimal Machine Learning Algorithm","Amini M., Hajianfar G., Hadadi Avval A., Nazari M., Deevband M.R., Oveisi M., Shiri I., Zaidi H.",09366555,"Clinical Oncology",34, 2,0,0,0,0,0,0,0,0,0,0,0,0,0,0,0,11,8,19,13,32
2022,"Static and transient analyses of Advanced Power Reactor 1400 (APR1400) initial core using open-source nodal core simulator KOMODO","Alnaqbi J., Hartanto D., Alnuaimi R., Imron M., Gillette V.",17385733,"Nuclear Engineering and Technology",54, 2,0,0,0,0,0,0,0,0,0,0,0,0,0,0,0,0,0,0,3,3
2022,"Adaptive user-oriented fuzzy-based service broker for cloud services","Al-Tarawneh M., Al-Mousa A.",13191578,"Journal of King Saud University - Computer and Information Sciences",34, 2,0,0,0,0,0,0,0,0,0,0,0,0,0,0,0,0,2,2,2,4
2022,"Runtime performance evaluation and optimization of type-2 hypervisor for MIPS64 architecture","Ain Q., Mehmood M.A.",13191578,"Journal of King Saud University - Computer and Information Sciences",34, 2,0,0,0,0,0,0,0,0,0,0,0,0,0,0,0,0,0,0,2,2
2022,"A reference open-source controller for fixed and floating offshore wind turbines","Abbas N.J., Zalkind D.S., Pao L., Wright A.",23667443,"Wind Energy Science",7, 1,0,0,0,0,0,0,0,0,0,0,0,0,0,0,0,0,20,20,38,58
2022,"MP-NeRF: A massively parallel method for accelerating protein structure reconstruction from internal coordinates","Alcaide E., Biderman S., Telenti A., Maher M.C.",01928651,"Journal of Computational Chemistry",43, 1,0,0,0,0,0,0,0,0,0,0,0,0,0,0,0,0,0,0,1,1
2022,"Agricultural Advisory Diagnostics Using a Data-Based Approach: Test Case in an Intensively Managed Rural Landscape in the Ganga River Basin, India","Adla S., Gupta S., Karumanchi S.H., Tripathi S., Disse M., Pande S.",26249375,"Frontiers in Water",3, ,0,0,0,0,0,0,0,0,0,0,0,0,0,0,0,0,0,0,1,1
2022,"Naview: A d3.js Based JavaScript Library for Drawing and Annotating Voltage-Gated Sodium Channels Membrane Diagrams","Afonso M.Q.L., da Fonseca Junior N.J., Miranda T.G., Bleicher L.",26737647,"Frontiers in Bioinformatics",2, ,0,0,0,0,0,0,0,0,0,0,0,0,0,0,0,0,0,0,0,0
2022,"Reinforcement Learning Based Optimal Adversarial Pathway Estimation Using Remotely Sensed Spectral-Terrain Data and Human Value Assessment","Affourtit J., Scott N.",25627767,"Proceedings of the International Conference on Statistics",, ,0,0,0,0,0,0,0,0,0,0,0,0,0,0,0,0,0,0,0,0
2022,"Engineering Open-Source Medical Devices: A Reliable Approach for Safe, Sustainable and Accessible Healthcare","Ahluwalia A., De Maria C., Diaz Lantada A.",,"Engineering Open-Source Medical Devices: A Reliable Approach for Safe, Sustainable and Accessible Healthcare",, ,0,0,0,0,0,0,0,0,0,0,0,0,0,0,0,0,0,0,0,0
2022,"On the Application of Wavelet Transform and Huffman Algorithm to Yorùbá Language Syntax Text Files Compression","Amusa K.A., Adewusi A., Erinosho T.C., Salawu S.A., Odufejo D.O.",14514869,"Serbian Journal of Electrical Engineering",19, 3,0,0,0,0,0,0,0,0,0,0,0,0,0,0,0,0,0,0,0,0
2022,"Ensemble Learning using Transformers and Convolutional Networks for Masked Face Recognition","Al-Sinan M.R., Haneef A.F., Luqman H.",,"Proceedings - 16th International Conference on Signal-Image Technology and Internet-Based Systems, SITIS 2022",, ,0,0,0,0,0,0,0,0,0,0,0,0,0,0,0,0,0,0,0,0
2022,"Shear Wave Imaging Framework for Quantification of Myocardial Tissue Properties","Andersen M.S., Sogaard P., Schmidt S.E., Struijk J.J.",23258861,"Computing in Cardiology",2022-, ,0,0,0,0,0,0,0,0,0,0,0,0,0,0,0,0,0,0,0,0
2022,"Retinal Image Restoration using Transformer and Cycle-Consistent Generative Adversarial Network","Alimanov A., Islam M.B.",,"2022 International Symposium on Intelligent Signal Processing and Communication Systems, ISPACS 2022",, ,0,0,0,0,0,0,0,0,0,0,0,0,0,0,0,0,0,0,1,1
2022,"Improving Code Review with GitHub Issue Tracking","Al-Rubaye A., Sukthankar G.",,"Proceedings of the 2022 IEEE/ACM International Conference on Advances in Social Networks Analysis and Mining, ASONAM 2022",, ,0,0,0,0,0,0,0,0,0,0,0,0,0,0,0,0,0,0,0,0
2022,"Telemetry-Based Software Failure Prediction by Concept-Space Model Creation","Afshinpour B., Groz R., Amini M.-R.",26939177,"IEEE International Conference on Software Quality, Reliability and Security, QRS",2022-, ,0,0,0,0,0,0,0,0,0,0,0,0,0,0,0,0,0,0,0,0
2022,"Service Classification through Machine Learning: Aiding in the Efficient Identification of Reusable Assets in Cloud Application Development","Alizadehsani Z., Feitosa D., Maikantis T., Ampatzoglou A., Chatzigeorgiou A., Berrocal D., Briones A.G., Corchado J.M., Mateus M., Groenewold J.",,"Proceedings - 48th Euromicro Conference on Software Engineering and Advanced Applications, SEAA 2022",, ,0,0,0,0,0,0,0,0,0,0,0,0,0,0,0,0,0,0,1,1
2022,"IMPLEMENTATION OF CWENO SCHEMES FOR COMPRESSIBLE MULTICOMPONENT/MULTIPHASE FLOW USING INTERFACE CAPTURING MODELS","Adebayo E.M., Tsoutsanis P., Jenkins K.W.",26966999,"World Congress in Computational Mechanics and ECCOMAS Congress",, ,0,0,0,0,0,0,0,0,0,0,0,0,0,0,0,0,0,0,0,0
2022,"A TIME-STAGGERED SECOND ORDER SCHEME FOR MOIST AIR VARIABLE DENSITY FLOW","Amino H., Flageul C., Carissimo B., Ferrand M., Herard J.M.",26966999,"World Congress in Computational Mechanics and ECCOMAS Congress",, ,0,0,0,0,0,0,0,0,0,0,0,0,0,0,0,0,0,0,0,0
2022,"Near Lossless Time Series Data Compression Methods using Statistics and Deviation","Agrawal V., Kuldeep G., Dey D.",,"2022 IEEE GLOBECOM Workshops, GC Wkshps 2022 - Proceedings",, ,0,0,0,0,0,0,0,0,0,0,0,0,0,0,0,0,0,0,0,0
2022,"A Low Cost Open Source Remote Monitoring System for Hospital Wastewater Management","Abiyasa A.P., Nuraga I.K., Satriadi A.M.",17551307,"IOP Conference Series: Earth and Environmental Science",1117, 1,0,0,0,0,0,0,0,0,0,0,0,0,0,0,0,0,0,0,0,0
2022,"Integrating User Reviews and Issue Reports of Mobile Apps for Change Requests Detection","Al-Safoury L., Salah A., Makady S.",2158107X,"International Journal of Advanced Computer Science and Applications",13, 12,0,0,0,0,0,0,0,0,0,0,0,0,0,0,0,0,0,0,0,0
2022,"[Extracting Factual Information about the Pandemic from Open Internet Sources, Извлечение фактографической информации о пандемии из открытых источников сети Интернет]","Akulinina E.Yu., Karmanov A.L., Teplykh N.A., Vlasov V.V., Baluta V.I., Varykhanov S.S., Karandeev A.A., Osipov V.P., Rykov Yu.G., Chetverushkin B.N.",19946538,"Mathematical Biology and Bioinformatics",17, 2,0,0,0,0,0,0,0,0,0,0,0,0,0,0,0,0,0,0,0,0
2022,"ANOMALIB: A DEEP LEARNING LIBRARY FOR ANOMALY DETECTION","Akcay S., Ameln D., Vaidya A., Lakshmanan B., Ahuja N., Genc U.",15224880,"Proceedings - International Conference on Image Processing, ICIP",, ,0,0,0,0,0,0,0,0,0,0,0,0,0,0,0,0,0,0,5,5
2022,"SLICING AIDED HYPER INFERENCE AND FINE-TUNING FOR SMALL OBJECT DETECTION","Akyon F.C., Altinuc S.O., Temizel A.",15224880,"Proceedings - International Conference on Image Processing, ICIP",, ,0,0,0,0,0,0,0,0,0,0,0,0,0,0,0,0,2,2,32,34
2022,"BOUNDING BOX DISPARITY: 3D METRICS FOR OBJECT DETECTION WITH FULL DEGREE OF FREEDOM","Adam M.G., Piccolrovazzi M., Eger S., Steinbach E.",15224880,"Proceedings - International Conference on Image Processing, ICIP",, ,0,0,0,0,0,0,0,0,0,0,0,0,0,0,0,0,0,0,0,0
2022,"TransformNet: Self-supervised Representation Learning Through Predicting Geometric Transformations","Ali M., Hashim S.",,"Proceedings of 2022 19th International Bhurban Conference on Applied Sciences and Technology, IBCAST 2022",, ,0,0,0,0,0,0,0,0,0,0,0,0,0,0,0,0,0,0,0,0
2022,"Transferring Dexterous Manipulation from GPU Simulation to a Remote Real-World TriFinger","Allshire A., Mittai M., Lodaya V., Makoviychuk V., Makoviichuk D., Widmaier F., Wuthrich M., Bauer S., Handa A., Garg A.",21530858,"IEEE International Conference on Intelligent Robots and Systems",2022-, ,0,0,0,0,0,0,0,0,0,0,0,0,0,0,0,0,0,0,1,1
2022,"Heuristic-free Optimization of Force-Controlled Robot Search Strategies in Stochastic Environments","Alt B., Katic D., Jakel R., Beetz M.",21530858,"IEEE International Conference on Intelligent Robots and Systems",2022-, ,0,0,0,0,0,0,0,0,0,0,0,0,0,0,0,0,0,0,0,0
2022,"Optimal Constrained Task Planning as Mixed Integer Programming","Adu-Bredu A., Devraj N., Jenkins O.C.",21530858,"IEEE International Conference on Intelligent Robots and Systems",2022-, ,0,0,0,0,0,0,0,0,0,0,0,0,0,0,0,0,0,0,1,1
2022,"Deep Reinforcement Learning based Robot Navigation in Dynamic Environments using Occupancy Values of Motion Primitives","Akmandor N.U., Li H., Lvov G., Dusel E., Padir T.",21530858,"IEEE International Conference on Intelligent Robots and Systems",2022-, ,0,0,0,0,0,0,0,0,0,0,0,0,0,0,0,0,0,0,1,1
2022,"JamRF: Performance Analysis, Evaluation, and Implementation of RF Jamming Over Wi-Fi","Ali A.S., Baddeley M., Bariah L., Lopez M.A., Lunardi W.T., Giacalone J.-P., Muhaidat S.",21693536,"IEEE Access",10, ,0,0,0,0,0,0,0,0,0,0,0,0,0,0,0,0,0,0,0,0
2022,"Evaluation of Context-Aware Language Models and Experts for Effort Estimation of Software Maintenance Issues","Alhamed M., Storer T.",,"Proceedings - 2022 IEEE International Conference on Software Maintenance and Evolution, ICSME 2022",, ,0,0,0,0,0,0,0,0,0,0,0,0,0,0,0,0,0,0,0,0
2022,"Experimental Validation of Nonlinear Optimization Frameworks for Solving Bundle Adjustment in Structure from Motion","Alouache A.",,"CCE 2022 - 2022 19th International Conference on Electrical Engineering, Computing Science and Automatic Control",, ,0,0,0,0,0,0,0,0,0,0,0,0,0,0,0,0,0,0,0,0
2022,"Evaluation of Average Term Occurrences Weighting Technique for Arabic Textual Information Retrieval","Abuata B.M., Al Omari L.A.",20885334,"International Journal on Advanced Science, Engineering and Information Technology",12, 6,0,0,0,0,0,0,0,0,0,0,0,0,0,0,0,0,0,0,0,0
2022,"Long-Tailed Instance Segmentation Using Gumbel Optimized Loss","Alexandridis K.P., Deng J., Nguyen A., Luo S.",03029743,"Lecture Notes in Computer Science (including subseries Lecture Notes in Artificial Intelligence and Lecture Notes in Bioinformatics)",13670, ,0,0,0,0,0,0,0,0,0,0,0,0,0,0,0,0,0,0,2,2
2022,"PlaneFormers: From Sparse View Planes to 3D Reconstruction","Agarwala S., Jin L., Rockwell C., Fouhey D.F.",03029743,"Lecture Notes in Computer Science (including subseries Lecture Notes in Artificial Intelligence and Lecture Notes in Bioinformatics)",13663, ,0,0,0,0,0,0,0,0,0,0,0,0,0,0,0,0,0,0,2,2
2022,"A Common Configurator Framework for Distributed Design, Collaboration and Verification Across the Full AEC Supply Chain","Al Fisher, Tsakiridis G., Lombardi A., Ahmad M., Watts A.",17551307,"IOP Conference Series: Earth and Environmental Science",1101, 9,0,0,0,0,0,0,0,0,0,0,0,0,0,0,0,0,0,0,0,0
2022,"BURIED WIRE DETECTION AND CLUSTERING ALGORITHM WITH GROUND PENETRATING RADAR","Akbulut O., Pakfiliz A.G.",24109142,"Review of Computer Engineering Research",9, 4,0,0,0,0,0,0,0,0,0,0,0,0,0,0,0,0,0,0,1,1
2022,"DESIGN OF AN IOT SMART CURRENT CONTROL SYSTEM BASED ON GOOGLE ASSISTANT","Abduljabbar A., Alsaydia O., Mahfoodh A., Mohammed R.",17293774,"Eastern-European Journal of Enterprise Technologies",5, 2-119,0,0,0,0,0,0,0,0,0,0,0,0,0,0,0,0,0,0,0,0
2022,"Self-Supervised Material and Texture Representation Learning for Remote Sensing Tasks","Akiva P., Purri M., Leotta M.",10636919,"Proceedings of the IEEE Computer Society Conference on Computer Vision and Pattern Recognition",2022-, ,0,0,0,0,0,0,0,0,0,0,0,0,0,0,0,0,2,2,9,11
2022,"IoT Network Intrusion Detection with Ensemble Learners","Abdulkareem S.A., Foh C.H., Lee H., Carrez F., Moessner K.",21621233,"International Conference on ICT Convergence",2022-, ,0,0,0,0,0,0,0,0,0,0,0,0,0,0,0,0,0,0,0,0
2022,"Combining BMC and Fuzzing Techniques for Finding Software Vulnerabilities in Concurrent Programs","Aljaafari F.K., Menezes R., Manino E., Shmarov F., Mustafa M.A., Cordeiro L.C.",21693536,"IEEE Access",10, ,0,0,0,0,0,0,0,0,0,0,0,0,0,0,0,0,0,0,2,2
2022,"HermesPy: An Open-Source Link-Level Evaluator for 6G","Adler J., Kronauer T., Barreto A.N.",21693536,"IEEE Access",10, ,0,0,0,0,0,0,0,0,0,0,0,0,0,0,0,0,0,0,2,2
2022,"Communication-Efficient Cluster Scalable Genomics Data Processing Using Apache Arrow Flight","Ahmad T., Ma C., Al-Ars Z., Hofstee H.P.",,"Proceedings - 2022 21st International Symposium on Parallel and Distributed Computing, ISPDC 2022",, ,0,0,0,0,0,0,0,0,0,0,0,0,0,0,0,0,0,0,0,0
2022,"On the Robustness of Quality Measures for GANs","Alfarra M., Perez J.C., Fruhstuck A., Torr P.H.S., Wonka P., Ghanem B.",03029743,"Lecture Notes in Computer Science (including subseries Lecture Notes in Artificial Intelligence and Lecture Notes in Bioinformatics)",13677, ,0,0,0,0,0,0,0,0,0,0,0,0,0,0,0,0,0,0,1,1
2022,"Self-Supervised Classification Network","Amrani E., Karlinsky L., Bronstein A.",03029743,"Lecture Notes in Computer Science (including subseries Lecture Notes in Artificial Intelligence and Lecture Notes in Bioinformatics)",13691, ,0,0,0,0,0,0,0,0,0,0,0,0,0,0,0,0,1,1,4,5
2022,"Embedding Contrastive Unsupervised Features to Cluster In- And Out-of-Distribution Noise in Corrupted Image Datasets","Albert P., Arazo E., O'Connor N.E., McGuinness K.",03029743,"Lecture Notes in Computer Science (including subseries Lecture Notes in Artificial Intelligence and Lecture Notes in Bioinformatics)",13691, ,0,0,0,0,0,0,0,0,0,0,0,0,0,0,0,0,0,0,0,0
2022,"Abstracting Sketches Through Simple Primitives","Alaniz S., Mancini M., Dutta A., Marcos D., Akata Z.",03029743,"Lecture Notes in Computer Science (including subseries Lecture Notes in Artificial Intelligence and Lecture Notes in Bioinformatics)",13689, ,0,0,0,0,0,0,0,0,0,0,0,0,0,0,0,0,0,0,0,0
2022,"Adaptive Birth for the GLMB Filter for Object Tracking in Satellite Videos","Aguilar C., Ortner M., Zerubia J.",21610363,"IEEE International Workshop on Machine Learning for Signal Processing, MLSP",2022-, ,0,0,0,0,0,0,0,0,0,0,0,0,0,0,0,0,0,0,0,0
2022,"BIcenter-AD: Harmonising Alzheimer's Disease cohorts using a common ETL tool","Almeida J.R., Pazos A., Oliveira J.L.",23529148,"Informatics in Medicine Unlocked",35, ,0,0,0,0,0,0,0,0,0,0,0,0,0,0,0,0,0,0,0,0
2022,"Deep Saliency Prior for Reducing Visual Distraction","Aberman K., He J., Gandelsman Y., Mosseri I., Jacobs D.E., Kohlhoff K., Pritch Y., Rubinstein M.",10636919,"Proceedings of the IEEE Computer Society Conference on Computer Vision and Pattern Recognition",2022-, ,0,0,0,0,0,0,0,0,0,0,0,0,0,0,0,0,0,0,4,4
2022,"SafeX: Open Source Hardware and Software Components for Safety-Critical Systems","Alcaide S., Cabo G., Bas F., Benedicte P., Fuentes F., Chang F., Lasfar I., Canal R., Abella J.",16369874,"Forum on Specification and Design Languages",2022-, ,0,0,0,0,0,0,0,0,0,0,0,0,0,0,0,0,0,0,1,1
2022,"WDV: A Broad Data Verbalisation Dataset Built from Wikidata","Amaral G., Rodrigues O., Simperl E.",03029743,"Lecture Notes in Computer Science (including subseries Lecture Notes in Artificial Intelligence and Lecture Notes in Bioinformatics)",13489, ,0,0,0,0,0,0,0,0,0,0,0,0,0,0,0,0,0,0,1,1
2022,"Blockchain-Based Processing of Health Insurance Claims for Prescription Drugs","Alnuaimi A., Alshehhi A., Salah K., Jayaraman R., Omar I.A., Battah A.",21693536,"IEEE Access",10, ,0,0,0,0,0,0,0,0,0,0,0,0,0,0,0,0,0,0,0,0
2022,"Individual tree detection from unmanned aerial vehicle (UAV) derived point cloud data in a mixed broadleaf forest using hierarchical graph approach","Ahmadi S.A., Ghorbanian A., Golparvar F., Mohammadzadeh A., Jamali S.",22797254,"European Journal of Remote Sensing",55, 1,0,0,0,0,0,0,0,0,0,0,0,0,0,0,0,0,0,0,2,2
2022,"NeuroUnlock: Unlocking the Architecture of Obfuscated Deep Neural Networks","Ahmadi M.M., Alrahis L., Colucci A., Sinanoglu O., Shafique M.",,"Proceedings of the International Joint Conference on Neural Networks",2022-, ,0,0,0,0,0,0,0,0,0,0,0,0,0,0,0,0,0,0,0,0
2022,"Enhanced Performance of Pre-Trained Networks by Matched Augmentation Distributions","Ahmad T., Jafarzadeh M., Dhamija A.R., Rabinowitz R., Cruz S., Li C., Boult T.E.",,"Proceedings of the International Joint Conference on Neural Networks",2022-, ,0,0,0,0,0,0,0,0,0,0,0,0,0,0,0,0,0,0,0,0
2022,"Automatic Segmentation of the Placenta in BOLD MRI Time Series","Abulnaga S.M., Young S.I., Hobgood K., Pan E., Wang C.J., Grant P.E., Abaci Turk E., Golland P.",03029743,"Lecture Notes in Computer Science (including subseries Lecture Notes in Artificial Intelligence and Lecture Notes in Bioinformatics)",13575, ,0,0,0,0,0,0,0,0,0,0,0,0,0,0,0,0,0,0,0,0
2022,"Pathology Synthesis of 3D Consistent Cardiac MR Images Using 2D VAEs and GANs","Amirrajab S., Lorenz C., Weese J., Pluim J., Breeuwer M.",03029743,"Lecture Notes in Computer Science (including subseries Lecture Notes in Artificial Intelligence and Lecture Notes in Bioinformatics)",13570, ,0,0,0,0,0,0,0,0,0,0,0,0,0,0,0,0,0,0,1,1
2022,"Cerebrovascular modelling for the management of aneurysm embolization using an intrasaccular flow diverter made by 3D printing","Algin O., Keles A., Oto C.",1733134X,"Polish Journal of Radiology",87, 1,0,0,0,0,0,0,0,0,0,0,0,0,0,0,0,0,0,0,2,2
2022,"Autonomous Palm Tree Detection from Remote Sensing Images-UAE Dataset","Al-Saad M., Aburaed N., Mansoori S.A., Ahmad H.A.",,"International Geoscience and Remote Sensing Symposium (IGARSS)",2022-, ,0,0,0,0,0,0,0,0,0,0,0,0,0,0,0,0,2,2,1,3
2022,"[Spatial Suitability Analysis for Identification of Best Sites for Collecting Photovoltaic Energy in the Kingdom of Saudi Arabia using Boolean Model, تصور الملاءمة المكانية لتحديد أنسب المواقع لتجميع الطاقة الكهروضوئية في المملكة (Boolean model) العربية السعودية وفق نموذج بولين]","Almutlaq F.",10263721,"Dirasat: Human and Social Sciences",49, 4,0,0,0,0,0,0,0,0,0,0,0,0,0,0,0,0,0,0,0,0
2022,"Automated question generation and question answering from Turkish texts","Akyon F.C., Cavusoglu D., Cengiz C., Altinuc S.O., Temizel A.",13000632,"Turkish Journal of Electrical Engineering and Computer Sciences",30, 5,0,0,0,0,0,0,0,0,0,0,0,0,0,0,0,0,1,1,0,1
2022,"Numerical Investigation of Flow and Thermal Behavior in Channels With PCM-Filled Thermal Energy Storage Columns for Potential Application in Photobioreactors","Akber S., Siddiqui K., DeGroot C.",08888116,"American Society of Mechanical Engineers, Fluids Engineering Division (Publication) FEDSM",2, ,0,0,0,0,0,0,0,0,0,0,0,0,0,0,0,0,0,0,0,0
2022,"Open-Domain, Content-based, Multi-modal Fact-checking of Out-of-Context Images via Online Resources","Abdelnabi S., Hasan R., Fritz M.",10636919,"Proceedings of the IEEE Computer Society Conference on Computer Vision and Pattern Recognition",2022-, ,0,0,0,0,0,0,0,0,0,0,0,0,0,0,0,0,1,1,11,12
2022,"NFT Certificates and Proof of Delivery for Fine Jewelry and Gemstones","Alnuaimi N., Almemari A., Madine M., Salah K., Breiki H.A., Jayaraman R.",21693536,"IEEE Access",10, ,0,0,0,0,0,0,0,0,0,0,0,0,0,0,0,0,0,0,4,4
2022,"Volume exclusion effects in perovskite charge transport modeling","Abdel D., Courtier N., Farrell P.",21583234,"Proceedings of the International Conference on Numerical Simulation of Optoelectronic Devices, NUSOD",2022-, ,0,0,0,0,0,0,0,0,0,0,0,0,0,0,0,0,0,0,2,2
2022,"Suppressing Poisoning Attacks on Federated Learning for Medical Imaging","Alkhunaizi N., Kamzolov D., Takac M., Nandakumar K.",03029743,"Lecture Notes in Computer Science (including subseries Lecture Notes in Artificial Intelligence and Lecture Notes in Bioinformatics)",13438, ,0,0,0,0,0,0,0,0,0,0,0,0,0,0,0,0,0,0,2,2
2022,"Self-Ensembling Vision Transformer (SEViT) for Robust Medical Image Classification","Almalik F., Yaqub M., Nandakumar K.",03029743,"Lecture Notes in Computer Science (including subseries Lecture Notes in Artificial Intelligence and Lecture Notes in Bioinformatics)",13433, ,0,0,0,0,0,0,0,0,0,0,0,0,0,0,0,0,1,1,8,9
2022,"Leveraging Labeling Representations in Uncertainty-Based Semi-supervised Segmentation","Adiga Vasudeva S., Dolz J., Lombaert H.",03029743,"Lecture Notes in Computer Science (including subseries Lecture Notes in Artificial Intelligence and Lecture Notes in Bioinformatics)",13438, ,0,0,0,0,0,0,0,0,0,0,0,0,0,0,0,0,0,0,4,4
2022,"GARDNet: Robust Multi-view Network for Glaucoma Classification in Color Fundus Images","Al-Mahrooqi A., Medvedev D., Muhtaseb R., Yaqub M.",03029743,"Lecture Notes in Computer Science (including subseries Lecture Notes in Artificial Intelligence and Lecture Notes in Bioinformatics)",13576, ,0,0,0,0,0,0,0,0,0,0,0,0,0,0,0,0,0,0,1,1
2022,"Software Defect Prediction and Analysis Using Enhanced Random Forest (extRF) Technique: A Business Process Management and Improvement Concept in IOT-Based Application Processing Environment","Alshammari F.H.",1574017X,"Mobile Information Systems",2022, ,0,0,0,0,0,0,0,0,0,0,0,0,0,0,0,0,0,0,2,2
2022,"Killing Two Birds with One Stone: Efficient and Robust Training of Face Recognition CNNs by Partial FC","An X., Deng J., Guo J., Feng Z., Zhu X., Yang J., Liu T.",10636919,"Proceedings of the IEEE Computer Society Conference on Computer Vision and Pattern Recognition",2022-, ,0,0,0,0,0,0,0,0,0,0,0,0,0,0,0,0,3,3,12,15
2022,"Comparison of Classification Model for the Detection of Cyber-attack using Ensemble Learning Models","Akhtar M.S., Feng T.",20329407,"EAI Endorsed Transactions on Scalable Information Systems",9, 5,0,0,0,0,0,0,0,0,0,0,0,0,0,0,0,0,2,2,1,3
2022,"Edge Workloads Monitoring and Failover: a StarlingX-Based Testbed Implementation and Measurement Study","Abuibaid M., Ghorab A.H., Seguin-Mcpeake A., Yuen O., Yungblut T., St-Hilaire M.",21693536,"IEEE Access",10, ,0,0,0,0,0,0,0,0,0,0,0,0,0,0,0,0,1,1,0,1
2022,"Unsupervised domain adaptation and super resolution on drone images for autonomous dry herbage biomass estimation","Albert P., Saadeldin M., Narayanan B., Namee B.M., Hennessy D., O'Connor N.E., McGuinness K.",21607508,"IEEE Computer Society Conference on Computer Vision and Pattern Recognition Workshops",2022-, ,0,0,0,0,0,0,0,0,0,0,0,0,0,0,0,0,0,0,3,3
2022,"UBnormal: New Benchmark for Supervised Open-Set Video Anomaly Detection","Acsintoae A., Florescu A., Georgescu M.-I., Mare T., Sumedrea P., Ionescu R.T., Khan F.S., Shah M.",10636919,"Proceedings of the IEEE Computer Society Conference on Computer Vision and Pattern Recognition",2022-, ,0,0,0,0,0,0,0,0,0,0,0,0,0,0,0,0,3,3,18,21
2022,"PySQIF, a Statistical Analysis Tool for Bi-SQUID Magnetometers","Akgun A., Razmkhah S.",17426588,"Journal of Physics: Conference Series",2323, 1,0,0,0,0,0,0,0,0,0,0,0,0,0,0,0,0,0,0,1,1
2022,"Designing and ERP System: A Sustainability Approach","Adriansyah A.K., Ridwan A.Y., Hediyanto U.Y.K.S.",25499904,"International Journal on Informatics Visualization",6, 2-2,0,0,0,0,0,0,0,0,0,0,0,0,0,0,0,0,0,0,0,0
2022,"Detecting security vulnerabilities with static analysis-A case study","Alqaradaghi M., Morseorcid G., Kozsik T.",17881994,"Pollack Periodica",17, 2,0,0,0,0,0,0,0,0,0,0,0,0,0,0,0,0,3,3,0,3
2022,"Segmentation and Quantitative Analysis of Epithelial Tissues","Aigouy B., Prud'homme B.",10643745,"Methods in Molecular Biology",2540, ,0,0,0,0,0,0,0,0,0,0,0,0,0,0,0,0,0,0,1,1
2022,"VISTA 2.0: An Open, Data-driven Simulator for Multimodal Sensing and Policy Learning for Autonomous Vehicles","Amini A., Wang T.-H., Gilitschenski I., Schwarting W., Liu Z., Han S., Karaman S., Rus D.",10504729,"Proceedings - IEEE International Conference on Robotics and Automation",, ,0,0,0,0,0,0,0,0,0,0,0,0,0,0,0,0,3,3,6,9
2022,"Memory-Disaggregated In-Memory Object Store Framework for Big Data Applications","Abrahamse R., Hadnagy A., Al-Ars Z.",,"Proceedings - 2022 IEEE 36th International Parallel and Distributed Processing Symposium Workshops, IPDPSW 2022",, ,0,0,0,0,0,0,0,0,0,0,0,0,0,0,0,0,0,0,0,0
